{
  "schemaVersion": 1,
  "id": "choplifter",
  "title": "Choplifter",
  "category": "Game",
  "disks": [
    {
      "file": "choplifter.dsk",
      "label": "disk1",
      "writeProtected": true,
      "mediaInstalled": false
    }
  ],
  "bootDisk": "choplifter.dsk",
  "defaultDrive1": "choplifter.dsk",
  "defaultDrive2": null,
  "joystickMode": "auto",
  "videoColorMode": "CompositeColor",
  "displayEffect": "Sharp",
  "effectStrength": "Off",
  "notes": "Metadata imported from apple2js catalog. Disk image not bundled with ESP][.",
  "mediaStatus": "not_installed",
  "source": {
    "type": "apple2js",
    "repository": "https://github.com/whscullin/apple2js",
    "site": "https://www.scullinsteel.com/apple2/",
    "upstreamCommit": "ee0aed25f73c69d0245e86a2a5fccb3324c3056c",
    "upstreamPath": "json/disks/choplifter.json",
    "upstreamUrl": "https://www.scullinsteel.com/apple2/json/disks/choplifter.json",
    "inGitRepo": false,
    "onWebsite": true
  },
  "redistribution": {
    "status": "USER_SUPPLIED_ONLY",
    "evidence": "Commercial Broderbund title. Listed on apple2js website catalog only; not in public git json/disks on inspected main. No redistribution grant found.",
    "preferredUpstream": null,
    "publisherHint": "Broderbund"
  }
}
